{
  "schema": "orch.result/implementer/v1",
  "run_id": "impl-271-r4-20261026T082244-7281ef",
  "verdict": "completed",
  "summary": "Tool-call markup in a stop answer is stripped only inside an unclosed <function=...>; a value ends at its first </parameter>.",
  "base_sha": "439227a370a3574e4ad52618264289d86f690bda",
  "head_sha": "439227a370a3574e4ad52618264289d86f690bda",
  "changed_files": [
    "src/request-safety.mjs",
    "test/request-safety.test.mjs"
  ],
  "tests": [
    {
      "cmd": "node --test test/request-safety.test.mjs (module from 439227a3)",
      "exit_code": 1,
      "status": "failed",
      "phase": "before_change",
      "summary": "red check: 8 fail",
      "optional": false
    },
    {
      "cmd": "node --test test/request-safety.test.mjs",
      "exit_code": 0,
      "status": "passed",
      "phase": "after_change",
      "summary": "129 pass",
      "optional": false
    },
    {
      "cmd": "node --test --test-name-pattern='parameter tag|holds </function>' test/summary.test.mjs test/restart.test.mjs (module from 439227a3)",
      "exit_code": 1,
      "status": "failed",
      "phase": "before_change",
      "summary": "red check, real runtime: 5 fail",
      "optional": false
    },
    {
      "cmd": "node --test --test-name-pattern='parameter tag|holds </function>' test/summary.test.mjs test/restart.test.mjs",
      "exit_code": 0,
      "status": "passed",
      "phase": "after_change",
      "summary": "13 pass",
      "optional": false
    },
    {
      "cmd": "node test/browser/live-sync.cjs  # R1: stream URL temporarily set back to '/api/events'",
      "exit_code": 1,
      "status": "failed",
      "phase": "before_change",
      "summary": "red as expected",
      "optional": false
    },
    {
      "cmd": "node test/browser/live-sync.cjs",
      "exit_code": 0,
      "status": "passed",
      "phase": "after_change",
      "summary": "ok",
      "optional": false
    },
    {
      "cmd": "red check — guest.go GuestAccess.User without `|| !hmac.Equal(...)`; cd gateway && go test -count=1 -run 'TestGuestLogin' ./cmd/gateway",
      "exit_code": 1,
      "status": "failed",
      "phase": "before_change",
      "summary": "red as expected",
      "optional": false
    },
    {
      "cmd": "cd gateway && go test -count=1 -run 'TestGuestLogin' ./cmd/gateway",
      "exit_code": 0,
      "status": "passed",
      "phase": "after_change",
      "summary": "ok",
      "optional": false
    },
    {
      "cmd": "make smoke",
      "exit_code": 0,
      "status": "passed",
      "phase": "after_change",
      "summary": "green",
      "optional": false
    }
  ],
  "acceptance": [
    {
      "id": "I4",
      "status": "met",
      "evidence": "unit + integration",
      "optional": false
    }
  ],
  "risks": [
    "Real model endpoint: not run (no credentials)."
  ],
  "rollback": "git checkout 439227a3 -- src/request-safety.mjs test/request-safety.test.mjs"
}
